{
  "$schema": "https://questfoundry.liesdonk.nl/manifests/playbook_manifest.schema.json",
  "manifest_version": "2.0.0",
  "playbook_id": "audio_pass",
  "display_name": "Audio Pass",
  "compiled_at": "2025-11-15T20:00:12.807676+00:00",
  "source_files": [
    "/home/runner/work/questfoundry/questfoundry/spec/05-behavior/playbooks/audio_pass.playbook.yaml",
    "/home/runner/work/questfoundry/questfoundry/spec/05-behavior/procedures/audio_plan_authoring.md",
    "/home/runner/work/questfoundry/questfoundry/spec/05-behavior/procedures/cue_slot_selection.md",
    "/home/runner/work/questfoundry/questfoundry/spec/05-behavior/procedures/leitmotif_management.md",
    "/home/runner/work/questfoundry/questfoundry/spec/05-behavior/procedures/audio_mix_ready_delivery.md",
    "/home/runner/work/questfoundry/questfoundry/spec/05-behavior/procedures/artifact_validation.md",
    "/home/runner/work/questfoundry/questfoundry/spec/05-behavior/procedures/audio_caption_text_alignment.md",
    "/home/runner/work/questfoundry/questfoundry/spec/05-behavior/procedures/spoiler_hygiene.md",
    "/home/runner/work/questfoundry/questfoundry/spec/05-behavior/procedures/audio_reproducibility_planning.md",
    "/home/runner/work/questfoundry/questfoundry/spec/05-behavior/procedures/audio_text_equivalents_captions.md",
    "/home/runner/work/questfoundry/questfoundry/spec/05-behavior/procedures/determinism_logging.md",
    "/home/runner/work/questfoundry/questfoundry/spec/05-behavior/procedures/dynamic_range_safety.md",
    "/home/runner/work/questfoundry/questfoundry/spec/05-behavior/procedures/audio_dynamic_range_safety.md"
  ],
  "category": "Asset",
  "purpose": "Decide what the audience should hear and why\u2014ambience, foley, stingers, or voice\u2014then (optionally) produce audio that fits style and narrative intent without leaking spoilers. This loop supports plan-only merges when the Audio Producer is dormant.",
  "outcome": "An Audio Plan (cues, purpose, timing/placement, captions/text-equivalents, safety notes) and, if active, audio assets with reproducibility notes. Ready for Gatekeeper checks and merge to Cold (plans may merge as deferred; assets merge only on full pass).",
  "steps": [],
  "raci": {
    "responsible": [
      "audio_director",
      "audio_producer"
    ],
    "accountable": [
      "showrunner"
    ],
    "consulted": [
      "style_lead",
      "player_narrator",
      "translator",
      "gatekeeper"
    ]
  },
  "quality_bars": [
    "presentation",
    "accessibility"
  ],
  "artifacts": [
    "audio_plan.schema.json",
    "cuelist.schema.json",
    "audio_render.schema.json",
    "determinism_log.schema.json",
    "safety_checklist.schema.json"
  ],
  "inputs": [
    "Cold snapshot (canon, codex, style guardrails)",
    "Target scenes/sections (Hot drafts acceptable for planning)",
    "PN Principles (diegetic references; no plumbing)",
    "Accessibility requirements (text equivalents, loudness safety)",
    "Localization posture (Translator active or dormant)"
  ]
}