{
  "$schema": "https://questfoundry.liesdonk.nl/manifests/playbook_manifest.schema.json",
  "manifest_version": "2.0.0",
  "playbook_id": "art_touch_up",
  "display_name": "Art Touch-up",
  "compiled_at": "2025-11-15T20:00:12.809273+00:00",
  "source_files": [
    "/home/runner/work/questfoundry/questfoundry/spec/05-behavior/playbooks/art_touch_up.playbook.yaml",
    "/home/runner/work/questfoundry/questfoundry/spec/05-behavior/procedures/art_plan_authoring.md",
    "/home/runner/work/questfoundry/questfoundry/spec/05-behavior/procedures/illustration_slot_selection.md",
    "/home/runner/work/questfoundry/questfoundry/spec/05-behavior/procedures/visual_language_maintenance.md",
    "/home/runner/work/questfoundry/questfoundry/spec/05-behavior/procedures/artifact_validation.md",
    "/home/runner/work/questfoundry/questfoundry/spec/05-behavior/procedures/spoiler_hygiene.md",
    "/home/runner/work/questfoundry/questfoundry/spec/05-behavior/procedures/alt_text_creation.md",
    "/home/runner/work/questfoundry/questfoundry/spec/05-behavior/procedures/art_determinism_planning.md",
    "/home/runner/work/questfoundry/questfoundry/spec/05-behavior/procedures/determinism_logging.md"
  ],
  "category": "Asset",
  "purpose": "Decide what to illustrate and why, then (optionally) produce illustrations that match style and narrative intent\u2014without leaking spoilers. This loop supports plan-only merges when the Illustrator is dormant.",
  "outcome": "An Art Plan (subjects, purpose, composition intent, captions, constraints) and, if active, art renders with determinism notes. Ready for Gatekeeper checks and merge to Cold (plans may merge as deferred; renders merge only on full pass).",
  "steps": [],
  "raci": {
    "responsible": [
      "art_director",
      "illustrator"
    ],
    "accountable": [
      "showrunner"
    ],
    "consulted": [
      "style_lead",
      "gatekeeper"
    ],
    "informed": [
      "codex_curator",
      "player_narrator"
    ]
  },
  "quality_bars": [
    "presentation",
    "accessibility"
  ],
  "artifacts": [
    "art_plan.schema.json",
    "shotlist.schema.json",
    "art_render.schema.json",
    "determinism_log.schema.json"
  ],
  "inputs": [
    "Current Cold snapshot (canon, codex, style guardrails)",
    "Target sections/scenes (Hot drafts acceptable for planning)",
    "Lore Deepening notes (spoiler flags), Codex entries (player-safe wording)",
    "Accessibility and PN considerations (alt text patterns, diegetic references)"
  ]
}